{
  "onu": {
    "id": "demo-onu-007",
    "display_name": "ONU DEMO-007",
    "serial_masked": "DEMO••••001",
    "manufacturer": "Fabricante demonstrativo",
    "model": "ONT Genérica A",
    "olt_name": "OLT POP Centro",
    "pon_ref": "0/1/1",
    "onu_id": "14"
  },
  "pon": {
    "state": "offline",
    "source": "olt",
    "observed_at": "2026-10-30T22:59:00-04:00",
    "collected_at": "2026-10-30T22:59:08-04:00",
    "freshness": "fresh"
  },
  "acs": {
    "state": "unknown",
    "source": "acs",
    "observed_at": "2026-10-30T19:01:00-04:00",
    "collected_at": "2026-10-30T19:01:02-04:00",
    "freshness": "stale"
  },
  "optical": {
    "rx_dbm": null,
    "severity": "unknown",
    "source": "olt",
    "observed_at": null,
    "collected_at": null,
    "freshness": "unavailable"
  },
  "association": {
    "confidence": "confirmed",
    "customer_display_name": "Cliente Demonstrativo 01",
    "contract_label": "Contrato DEMO-A",
    "source": "base de associação (demo)"
  },
  "visual": {
    "type": "generic",
    "template_id": null,
    "leds_homologated": false
  },
  "authorization": {
    "can_view_customer": true,
    "can_open_360": true,
    "can_investigate": false
  },
  "capabilities": {
    "has_optical_rx": true,
    "has_acs": true,
    "has_investigation_flow": false
  }
}
