{
  "onu": {
    "id": "demo-onu-005",
    "display_name": "ONU DEMO-005",
    "serial_masked": "DEMO••••001",
    "manufacturer": null,
    "model": null,
    "olt_name": "OLT POP Centro",
    "pon_ref": "0/1/1",
    "onu_id": "14"
  },
  "pon": {
    "state": "online",
    "source": "olt",
    "observed_at": "2026-10-30T22:59:00-04:00",
    "collected_at": "2026-10-30T22:59:08-04:00",
    "freshness": "fresh"
  },
  "acs": {
    "state": "unknown",
    "source": "unknown",
    "observed_at": null,
    "collected_at": null,
    "freshness": "unsupported"
  },
  "optical": {
    "rx_dbm": null,
    "severity": "unknown",
    "source": "olt",
    "observed_at": "2026-10-30T22:59:00-04:00",
    "collected_at": "2026-10-30T22:59:08-04:00",
    "freshness": "unsupported"
  },
  "association": {
    "confidence": "unassociated",
    "customer_display_name": null,
    "contract_label": null,
    "source": "base de associação (demo)"
  },
  "visual": {
    "type": "generic",
    "template_id": null,
    "leds_homologated": false
  },
  "authorization": {
    "can_view_customer": true,
    "can_open_360": true,
    "can_investigate": false
  },
  "capabilities": {
    "has_optical_rx": false,
    "has_acs": false,
    "has_investigation_flow": false
  }
}
